{
  "$schema": "https://json-schema.org/draft/2020-12/schema",
  "title": "Camunda migration validation evidence",
  "type": "object",
  "additionalProperties": false,
  "required": ["schema_version", "mode", "modules", "models", "checks"],
  "properties": {
    "schema_version": {
      "const": 1
    },
    "mode": {
      "const": "migration"
    },
    "modules": {
      "type": "array",
      "items": {
        "type": "object",
        "additionalProperties": false,
        "required": ["path", "runtime_mode", "test_suites"],
        "properties": {
          "path": {
            "type": "string",
            "minLength": 1
          },
          "runtime_mode": {
            "enum": ["spring-boot", "external-launcher", "none"]
          },
          "test_suites": {
            "type": "array",
            "items": {
              "type": "object",
              "additionalProperties": false,
              "required": ["name", "requires_docker"],
              "properties": {
                "name": {
                  "type": "string",
                  "minLength": 1
                },
                "requires_docker": {
                  "type": "boolean"
                }
              }
            }
          }
        }
      }
    },
    "models": {
      "type": "array",
      "items": {
        "type": "object",
        "additionalProperties": false,
        "required": [
          "path",
          "source_path",
          "type",
          "approach",
          "deployable",
          "source_has_di",
          "form_inventory",
          "processes",
          "recurring_timer_starts"
        ],
        "properties": {
          "path": {
            "type": "string",
            "minLength": 1
          },
          "source_path": {
            "type": "string",
            "minLength": 1
          },
          "type": {
            "enum": ["bpmn", "dmn"]
          },
          "approach": {
            "enum": ["M1", "M2", "M3", "E1"]
          },
          "deployable": {
            "type": "boolean"
          },
          "source_has_di": {
            "type": "boolean"
          },
          "form_inventory": {
            "type": "array",
            "items": {
              "type": "object",
              "additionalProperties": false,
              "required": [
                "id",
                "kind",
                "accepted",
                "schema_applicable",
                "form_js_applicable",
                "binding_required"
              ],
              "properties": {
                "id": {
                  "type": "string",
                  "minLength": 1
                },
                "kind": {
                  "enum": ["generated", "referenced", "form-free-owner"]
                },
                "accepted": {
                  "type": "boolean"
                },
                "schema_applicable": {
                  "type": "boolean"
                },
                "form_js_applicable": {
                  "type": "boolean"
                },
                "binding_required": {
                  "type": "boolean"
                }
              },
              "allOf": [
                {
                  "if": {
                    "properties": {
                      "kind": {
                        "const": "form-free-owner"
                      }
                    },
                    "required": ["kind"]
                  },
                  "then": {
                    "properties": {
                      "accepted": {
                        "const": false
                      },
                      "schema_applicable": {
                        "const": false
                      },
                      "form_js_applicable": {
                        "const": false
                      },
                      "binding_required": {
                        "const": false
                      }
                    }
                  }
                },
                {
                  "if": {
                    "properties": {
                      "accepted": {
                        "const": false
                      }
                    },
                    "required": ["accepted"]
                  },
                  "then": {
                    "properties": {
                      "schema_applicable": {
                        "const": false
                      },
                      "form_js_applicable": {
                        "const": false
                      },
                      "binding_required": {
                        "const": false
                      }
                    }
                  }
                }
              ]
            }
          },
          "processes": {
            "type": "array",
            "items": {
              "type": "object",
              "additionalProperties": false,
              "required": [
                "id",
                "executable",
                "standalone_entry_point",
                "direct_start_scenarios",
                "missing_worker_input_scenarios",
                "covering_test",
                "reason"
              ],
              "properties": {
                "id": {
                  "type": "string",
                  "minLength": 1
                },
                "executable": {
                  "type": "boolean"
                },
                "standalone_entry_point": {
                  "type": "boolean"
                },
                "direct_start_scenarios": {
                  "type": "array",
                  "items": {
                    "type": "string",
                    "minLength": 1
                  }
                },
                "missing_worker_input_scenarios": {
                  "type": "array",
                  "description": "Independently reviewed worker-input omission scenarios for a standalone process.",
                  "items": {
                    "type": "string",
                    "minLength": 1
                  }
                },
                "covering_test": {
                  "type": ["string", "null"]
                },
                "reason": {
                  "type": ["string", "null"]
                },
                "assertion_applicability": {
                  "type": "object",
                  "additionalProperties": false,
                  "required": [
                    "user_task_type",
                    "downstream_message_instance",
                    "branch_selection",
                    "worker_input_output",
                    "incident_behavior",
                    "form_resolution"
                  ],
                  "properties": {
                    "user_task_type": {
                      "type": "boolean"
                    },
                    "downstream_message_instance": {
                      "type": "boolean"
                    },
                    "branch_selection": {
                      "type": "boolean"
                    },
                    "worker_input_output": {
                      "type": "boolean"
                    },
                    "incident_behavior": {
                      "type": "boolean"
                    },
                    "form_resolution": {
                      "type": "boolean"
                    }
                  }
                }
              },
              "allOf": [
                {
                  "if": {
                    "properties": {
                      "executable": {
                        "const": true
                      }
                    },
                    "required": ["executable"]
                  },
                  "then": {
                    "required": ["assertion_applicability"]
                  }
                }
              ]
            }
          },
          "recurring_timer_starts": {
            "type": "array",
            "items": {
              "type": "object",
              "additionalProperties": false,
              "required": ["process_id", "id"],
              "properties": {
                "process_id": {
                  "type": "string",
                  "minLength": 1
                },
                "id": {
                  "type": "string",
                  "minLength": 1
                }
              }
            }
          }
        }
      }
    },
    "checks": {
      "type": "array",
      "items": {
        "type": "object",
        "additionalProperties": false,
        "required": [
          "target_type",
          "target",
          "kind",
          "scenario",
          "method",
          "command",
          "exit_code",
          "result",
          "evidence_path",
          "reason",
          "blocker_reason",
          "failure_class",
          "environment"
        ],
        "properties": {
          "target_type": {
            "enum": ["project", "module", "model", "process", "timer"]
          },
          "target": {
            "type": "string",
            "minLength": 1
          },
          "kind": {
            "type": "string",
            "minLength": 1
          },
          "scenario": {
            "type": ["string", "null"]
          },
          "method": {
            "enum": ["command", "manual", "not_applicable"],
            "description": "Manual evidence is limited to the check kinds documented as manual."
          },
          "command": {
            "type": "string",
            "minLength": 1
          },
          "exit_code": {
            "type": ["integer", "null"]
          },
          "result": {
            "enum": [
              "passed",
              "failed",
              "blocked",
              "unknown",
              "not_run",
              "not_applicable"
            ]
          },
          "evidence_path": {
            "type": ["string", "null"],
            "pattern": "^\\.camunda-migration/validation/logs/.+",
            "description": "A relative path under .camunda-migration/validation/logs/."
          },
          "reason": {
            "type": ["string", "null"]
          },
          "blocker_reason": {
            "type": ["string", "null"]
          },
          "failure_class": {
            "type": ["string", "null"]
          },
          "environment": {
            "enum": [
              "local",
              "non-production",
              "production",
              "unknown",
              "not-deployed",
              null
            ]
          },
          "isolation_or_cleanup_plan": {
            "type": ["string", "null"],
            "description": "The isolation or cleanup plan for a timer preflight."
          }
        },
        "allOf": [
          {
            "if": {
              "properties": {
                "target_type": {
                  "const": "timer"
                },
                "kind": {
                  "const": "timer_preflight"
                }
              },
              "required": ["target_type", "kind"]
            },
            "then": {
              "required": ["isolation_or_cleanup_plan"],
              "properties": {
                "isolation_or_cleanup_plan": {
                  "type": "string",
                  "minLength": 1
                }
              }
            },
            "else": {
              "properties": {
                "isolation_or_cleanup_plan": {
                  "type": "null"
                }
              }
            }
          }
        ]
      }
    }
  },
  "anyOf": [
    {
      "properties": {
        "modules": {
          "minItems": 1
        }
      }
    },
    {
      "properties": {
        "models": {
          "minItems": 1
        }
      }
    }
  ]
}
