{
  "schema_version": 1,
  "mode": "migration",
  "modules": [
    {
      "path": "examples/web",
      "runtime_mode": "none",
      "test_suites": [
        {
          "name": "web-smoke",
          "requires_docker": false
        },
        {
          "name": "container-integration",
          "requires_docker": true
        }
      ]
    },
    {
      "path": "examples/account",
      "runtime_mode": "none",
      "test_suites": [
        {
          "name": "unit",
          "requires_docker": false
        }
      ]
    },
    {
      "path": "examples/loan",
      "runtime_mode": "none",
      "test_suites": [
        {
          "name": "unit",
          "requires_docker": false
        }
      ]
    },
    {
      "path": "examples/order",
      "runtime_mode": "none",
      "test_suites": [
        {
          "name": "unit",
          "requires_docker": false
        }
      ]
    },
    {
      "path": "examples/invoice",
      "runtime_mode": "none",
      "test_suites": [
        {
          "name": "unit",
          "requires_docker": false
        }
      ]
    },
    {
      "path": "examples/messaging",
      "runtime_mode": "none",
      "test_suites": [
        {
          "name": "unit",
          "requires_docker": false
        }
      ]
    },
    {
      "path": "examples/customer",
      "runtime_mode": "none",
      "test_suites": [
        {
          "name": "unit",
          "requires_docker": false
        }
      ]
    },
    {
      "path": "examples/runtime-api",
      "runtime_mode": "spring-boot",
      "test_suites": [
        {
          "name": "unit",
          "requires_docker": false
        }
      ]
    },
    {
      "path": "examples/runtime-worker",
      "runtime_mode": "spring-boot",
      "test_suites": [
        {
          "name": "unit",
          "requires_docker": false
        }
      ]
    }
  ],
  "models": [
    {
      "path": "models/converted-c8-order.bpmn",
      "source_path": "models/order.bpmn",
      "type": "bpmn",
      "approach": "M2",
      "deployable": true,
      "source_has_di": false,
      "form_inventory": [],
      "processes": [
        {
          "id": "order-process",
          "executable": true,
          "standalone_entry_point": true,
          "direct_start_scenarios": [
            "normal"
          ],
          "missing_worker_input_scenarios": [],
          "covering_test": null,
          "reason": null,
          "assertion_applicability": {
            "user_task_type": true,
            "downstream_message_instance": true,
            "branch_selection": true,
            "worker_input_output": true,
            "incident_behavior": true,
            "form_resolution": true
          }
        }
      ],
      "recurring_timer_starts": [
        {
          "process_id": "order-process",
          "id": "repeat-start"
        }
      ]
    },
    {
      "path": "models/converted-c8-account.bpmn",
      "source_path": "models/account.bpmn",
      "type": "bpmn",
      "approach": "M2",
      "deployable": true,
      "source_has_di": false,
      "form_inventory": [],
      "processes": [
        {
          "id": "account-process",
          "executable": true,
          "standalone_entry_point": true,
          "direct_start_scenarios": [
            "normal"
          ],
          "missing_worker_input_scenarios": [],
          "covering_test": null,
          "reason": null,
          "assertion_applicability": {
            "user_task_type": true,
            "downstream_message_instance": true,
            "branch_selection": true,
            "worker_input_output": true,
            "incident_behavior": true,
            "form_resolution": true
          }
        }
      ],
      "recurring_timer_starts": []
    },
    {
      "path": "models/converted-c8-loan.bpmn",
      "source_path": "models/loan.bpmn",
      "type": "bpmn",
      "approach": "M2",
      "deployable": true,
      "source_has_di": false,
      "form_inventory": [],
      "processes": [
        {
          "id": "loan-process",
          "executable": true,
          "standalone_entry_point": true,
          "direct_start_scenarios": [
            "normal"
          ],
          "missing_worker_input_scenarios": [],
          "covering_test": null,
          "reason": null,
          "assertion_applicability": {
            "user_task_type": true,
            "downstream_message_instance": true,
            "branch_selection": true,
            "worker_input_output": true,
            "incident_behavior": true,
            "form_resolution": true
          }
        }
      ],
      "recurring_timer_starts": []
    },
    {
      "path": "models/converted-c8-invoice.bpmn",
      "source_path": "models/invoice.bpmn",
      "type": "bpmn",
      "approach": "M2",
      "deployable": true,
      "source_has_di": false,
      "form_inventory": [],
      "processes": [
        {
          "id": "invoice-process",
          "executable": true,
          "standalone_entry_point": true,
          "direct_start_scenarios": [
            "normal"
          ],
          "missing_worker_input_scenarios": [],
          "covering_test": null,
          "reason": null,
          "assertion_applicability": {
            "user_task_type": true,
            "downstream_message_instance": true,
            "branch_selection": true,
            "worker_input_output": true,
            "incident_behavior": true,
            "form_resolution": true
          }
        }
      ],
      "recurring_timer_starts": []
    },
    {
      "path": "models/converted-c8-customer.bpmn",
      "source_path": "models/customer.bpmn",
      "type": "bpmn",
      "approach": "M2",
      "deployable": true,
      "source_has_di": false,
      "form_inventory": [],
      "processes": [
        {
          "id": "customer-process",
          "executable": true,
          "standalone_entry_point": true,
          "direct_start_scenarios": [
            "normal"
          ],
          "missing_worker_input_scenarios": [],
          "covering_test": null,
          "reason": null,
          "assertion_applicability": {
            "user_task_type": true,
            "downstream_message_instance": true,
            "branch_selection": true,
            "worker_input_output": true,
            "incident_behavior": true,
            "form_resolution": true
          }
        }
      ],
      "recurring_timer_starts": []
    },
    {
      "path": "models/converted-c8-messaging.bpmn",
      "source_path": "models/messaging.bpmn",
      "type": "bpmn",
      "approach": "M2",
      "deployable": true,
      "source_has_di": false,
      "form_inventory": [],
      "processes": [
        {
          "id": "messaging-process",
          "executable": true,
          "standalone_entry_point": true,
          "direct_start_scenarios": [
            "normal"
          ],
          "missing_worker_input_scenarios": [],
          "covering_test": null,
          "reason": null,
          "assertion_applicability": {
            "user_task_type": true,
            "downstream_message_instance": true,
            "branch_selection": true,
            "worker_input_output": true,
            "incident_behavior": true,
            "form_resolution": true
          }
        }
      ],
      "recurring_timer_starts": []
    },
    {
      "path": "models/converted-c8-customer-archive.bpmn",
      "source_path": "models/customer-archive.bpmn",
      "type": "bpmn",
      "approach": "M2",
      "deployable": true,
      "source_has_di": false,
      "form_inventory": [],
      "processes": [
        {
          "id": "customer-archive-process",
          "executable": true,
          "standalone_entry_point": true,
          "direct_start_scenarios": [
            "normal"
          ],
          "missing_worker_input_scenarios": [],
          "covering_test": null,
          "reason": null,
          "assertion_applicability": {
            "user_task_type": true,
            "downstream_message_instance": true,
            "branch_selection": true,
            "worker_input_output": true,
            "incident_behavior": true,
            "form_resolution": true
          }
        }
      ],
      "recurring_timer_starts": []
    },
    {
      "path": "models/converted-c8-eligibility.bpmn",
      "source_path": "models/eligibility.bpmn",
      "type": "bpmn",
      "approach": "M2",
      "deployable": true,
      "source_has_di": false,
      "form_inventory": [],
      "processes": [
        {
          "id": "eligibility-process",
          "executable": true,
          "standalone_entry_point": true,
          "direct_start_scenarios": [
            "normal"
          ],
          "missing_worker_input_scenarios": [],
          "covering_test": null,
          "reason": null,
          "assertion_applicability": {
            "user_task_type": true,
            "downstream_message_instance": true,
            "branch_selection": true,
            "worker_input_output": true,
            "incident_behavior": true,
            "form_resolution": true
          }
        }
      ],
      "recurring_timer_starts": []
    },
    {
      "path": "models/converted-c8-notification.bpmn",
      "source_path": "models/notification.bpmn",
      "type": "bpmn",
      "approach": "M2",
      "deployable": true,
      "source_has_di": false,
      "form_inventory": [],
      "processes": [
        {
          "id": "notification-process",
          "executable": true,
          "standalone_entry_point": true,
          "direct_start_scenarios": [
            "normal"
          ],
          "missing_worker_input_scenarios": [],
          "covering_test": null,
          "reason": null,
          "assertion_applicability": {
            "user_task_type": true,
            "downstream_message_instance": true,
            "branch_selection": true,
            "worker_input_output": true,